### ISSUE TITLE
Intermittent connection reset

### ISSUE THREAD

**Issue by canha** [mcavage/node-ldapjs#293]
After having my script not finish properly because of a connection problem with LDAP I decided to run tcpdump and analyze what's going on. From time to time - 1 in 200 connection attempts on average, spaced out a couple minutes between each attempt - for no apparent reason the script won't just connect.

What I captured were 3 packets when this problem occurs - this is the full connection log:

Machine 1 (Client) -> Machine 2 (LDAP) | TCP	74	60001→389 [SYN] Seq=0 Win=14600 Len=0 MSS=1460 SACK_PERM=1 TSval=758735719 TSecr=0 WS=128

Machine 2 (LDAP) -> Machine 1 (Client) | TCP	74	389→60001 [SYN, ACK] Seq=0 Ack=1 Win=5792 Len=0 MSS=1380 SACK_PERM=1 TSval=735394122 TSecr=758735719 WS=128

Machine 1 (Client) -> Machine 2 | (LDAP) TCP	54	60001→389 [RST] Seq=1 Win=0 Len=0

No more traffic after that. It seems a connection reset flag is being sent to the LDAP server. Does anyone have a clue on why does this happen? And how can it be solved? If I immediatly try to re-run the script again it works just fine.

ldapjs version: 0.7.1 (Using normal connection, no pooling)
NodeJS version: 0.12.7
ClientOS: Debian 7

**Comment by canha** [comment]
This doesn't seem to happen when connection pooling is used.

**Comment by jsumners** [comment]
⚠️ This issue has been locked due to age. If you have encountered a recent
problem that seems to be covered by this issue, please open a new issue.

Please include a [minimal reproducible example](https://en.wikipedia.org/wiki/Minimal_reproducible_example)
when opening a new issue.
